{
  "$schema": "http://json-schema.org/draft-07/schema#",
  "$id": "https://github.com/SunTasked/warehouse-visualizer/schema/warehouse.schema.json",
  "title": "Warehouse Configuration (physical layout, v5)",
  "description": "Physical layer of a warehouse: building walls, doors, the corridor network, lift stations, delivery spaces, storage slot footprints, and each slot's physical depth. Coordinates are in meters (1 unit = 1m), origin at the bottom-left of the site, +X right, +Y up. This describes what physically exists (the building), not what's currently stocked (see warehouse.content.schema.json). The corridor network is named junctions and corridors listing the junctions they run through: two corridors connect exactly when they name the same junction. Slots and pads state the corridor they are worked from (`access`). A config file is loaded first; its content file (referencing this file's `id` as `warehouseId`) is loaded second and merged in.",
  "type": "object",
  "required": ["id", "name", "units", "walls", "slotDefaults", "slots"],
  "additionalProperties": false,
  "properties": {
    "id": {
      "type": "string",
      "description": "Unique identifier for this warehouse/building."
    },
    "name": {
      "type": "string",
      "description": "Human-readable name, e.g. \"Batiment 13A\"."
    },
    "units": {
      "type": "string",
      "enum": ["m"],
      "description": "Fixed to meters for now; kept explicit so other units can be supported later without an ambiguous scale."
    },
    "walls": {
      "type": "array",
      "description": "One or more wall loops/polylines. Each is an ordered list of corner points. Supports irregular outlines, notches, and multiple disjoint structures (e.g. a detached annex) by using multiple entries.",
      "items": { "$ref": "#/definitions/wallLoop" }
    },
    "doors": {
      "type": "array",
      "description": "Openings in a building's wall to the exterior or to another building. Optional — absent in files predating this field, treated as empty.",
      "items": { "$ref": "#/definitions/door" }
    },
    "junctions": {
      "type": "array",
      "description": "The corridor network's named points: where corridors meet, end, bend or pass through a door. Names follow the plant's convention (specs.md §5.7), e.g. \"13A.CENTRAL+AA\", \"AA.E\", \"13A.S\".",
      "items": { "$ref": "#/definitions/junction" }
    },
    "corridors": {
      "type": "array",
      "description": "Named corridors, each the junctions it runs through in order, e.g. aisle \"AA\", \"13A.CENTRAL\", the link \"13A-12B\".",
      "items": { "$ref": "#/definitions/corridor" }
    },
    "paths": {
      "type": "array",
      "description": "Legacy corridor format (polylines connected only by exactly coincident coordinates). Read, and converted to junctions and corridors, when `corridors` is absent; never written.",
      "items": { "$ref": "#/definitions/path" }
    },
    "liftStations": {
      "type": "array",
      "description": "Carriage lift stations (fixed 6x2m footprint for now). Optional — absent in files predating this field, treated as empty.",
      "items": { "$ref": "#/definitions/liftStation" }
    },
    "deliverySpaces": {
      "type": "array",
      "description": "Delivery spaces (fixed 6x2m footprint, same as liftStation, for now). Optional — absent in files predating this field, treated as empty.",
      "items": { "$ref": "#/definitions/deliverySpace" }
    },
    "inaccessibleZones": {
      "type": "array",
      "description": "Floor areas forklifts can't enter (a lithium store, a tugger-train lane...), drawn hatched. Corridors are laid out around them. Optional — absent in files predating this field, treated as empty.",
      "items": { "$ref": "#/definitions/inaccessibleZone" }
    },
    "slotDefaults": {
      "$ref": "#/definitions/slotSize",
      "description": "Default footprint applied to every slot for now (all slots are the same size: 4m x 2m)."
    },
    "slots": {
      "type": "array",
      "items": { "$ref": "#/definitions/slot" }
    }
  },
  "definitions": {
    "point": {
      "type": "object",
      "required": ["x", "y"],
      "additionalProperties": false,
      "properties": {
        "x": { "type": "number" },
        "y": { "type": "number" }
      }
    },
    "wallLoop": {
      "type": "object",
      "required": ["id", "closed", "points"],
      "additionalProperties": false,
      "properties": {
        "id": { "type": "string" },
        "closed": {
          "type": "boolean",
          "description": "If true, an implicit segment connects the last point back to the first, forming a closed polygon. If false, it's an open polyline."
        },
        "points": {
          "type": "array",
          "minItems": 2,
          "items": { "$ref": "#/definitions/point" }
        }
      }
    },
    "door": {
      "type": "object",
      "required": ["id", "x", "y", "buildingId"],
      "additionalProperties": false,
      "properties": {
        "id": { "type": "string" },
        "x": { "type": "number" },
        "y": { "type": "number" },
        "rotationDeg": {
          "type": "number",
          "default": 0,
          "description": "Orientation along the wall it's set into, in degrees — same convention as slot.rotationDeg."
        },
        "width": {
          "type": "number",
          "exclusiveMinimum": 0,
          "description": "Opening width in meters. Defaults to the renderer's DOOR_DEFAULT_WIDTH when omitted."
        },
        "buildingId": {
          "type": "string",
          "description": "Which building's wall (a walls[].id of a closed loop) this door is cut into."
        },
        "leadsTo": {
          "type": "string",
          "description": "Another building's id, if this door connects two buildings rather than leading outside."
        }
      }
    },
    "junction": {
      "type": "object",
      "required": ["id", "x", "y"],
      "additionalProperties": false,
      "properties": {
        "id": { "type": "string" },
        "x": { "type": "number" },
        "y": { "type": "number" },
        "buildingId": {
          "type": "string",
          "description": "The building it stands in (a door's junction: the door's building). Omitted outdoors."
        }
      }
    },
    "corridor": {
      "type": "object",
      "required": ["id", "junctions"],
      "additionalProperties": false,
      "properties": {
        "id": { "type": "string" },
        "junctions": {
          "type": "array",
          "minItems": 2,
          "items": { "type": "string" },
          "description": "Junction ids, in order along the corridor."
        },
        "width": {
          "type": "number",
          "exclusiveMinimum": 0,
          "description": "Corridor width in meters. Defaults to the renderer's PATH_DEFAULT_WIDTH when omitted."
        }
      }
    },
    "access": {
      "type": "object",
      "required": ["corridor", "offset"],
      "additionalProperties": false,
      "description": "Where a slot or pad joins the corridor network. Without it the app uses the nearest corridor (in front of a slot).",
      "properties": {
        "corridor": { "type": "string", "description": "A corridors[].id." },
        "offset": { "type": "number", "minimum": 0, "description": "Meters along the corridor from its first junction." }
      }
    },
    "path": {
      "type": "object",
      "required": ["id", "points", "buildingIds"],
      "additionalProperties": false,
      "properties": {
        "id": { "type": "string" },
        "points": {
          "type": "array",
          "minItems": 2,
          "items": { "$ref": "#/definitions/point" },
          "description": "A point shared with another path's points, or with a door's position, must be an exact coincident coordinate — see the top-level description's graph-readiness note."
        },
        "width": {
          "type": "number",
          "exclusiveMinimum": 0,
          "description": "Corridor width in meters. Defaults to the renderer's PATH_DEFAULT_WIDTH when omitted."
        },
        "buildingIds": {
          "type": "array",
          "minItems": 1,
          "items": { "type": "string" },
          "description": "Usually one building; two for a connector that crosses between buildings."
        },
        "endpointBuildingIds": {
          "type": "array",
          "minItems": 2,
          "maxItems": 2,
          "items": { "type": "string" },
          "description": "Cross-building connectors only (buildingIds.length > 1): which building owns points[0] and which owns the last point, in that order."
        }
      }
    },
    "liftStation": {
      "type": "object",
      "required": ["id", "x", "y", "buildingId"],
      "additionalProperties": false,
      "properties": {
        "id": { "type": "string" },
        "x": { "type": "number" },
        "y": { "type": "number" },
        "rotationDeg": { "type": "number", "default": 0 },
        "buildingId": { "type": "string" },
        "access": { "$ref": "#/definitions/access" }
      }
    },
    "deliverySpace": {
      "type": "object",
      "required": ["id", "x", "y", "buildingId"],
      "additionalProperties": false,
      "properties": {
        "id": { "type": "string" },
        "x": { "type": "number" },
        "y": { "type": "number" },
        "rotationDeg": { "type": "number", "default": 0 },
        "buildingId": { "type": "string" },
        "access": { "$ref": "#/definitions/access" }
      }
    },
    "inaccessibleZone": {
      "type": "object",
      "required": ["id", "label", "x", "y", "width", "depth", "buildingId"],
      "additionalProperties": false,
      "properties": {
        "id": { "type": "string" },
        "label": { "type": "string", "description": "What the plan calls the area, e.g. \"Lithium\", \"Zone MU\", \"Train\"." },
        "x": { "type": "number", "description": "Centre X, in meters." },
        "y": { "type": "number", "description": "Centre Y, in meters." },
        "width": { "type": "number", "exclusiveMinimum": 0, "description": "Extent along X, in meters (axis-aligned)." },
        "depth": { "type": "number", "exclusiveMinimum": 0, "description": "Extent along Y, in meters (axis-aligned)." },
        "buildingId": { "type": "string" }
      }
    },
    "slotSize": {
      "type": "object",
      "required": ["width", "height"],
      "additionalProperties": false,
      "properties": {
        "width": {
          "type": "number",
          "exclusiveMinimum": 0,
          "description": "Footprint size along the slot's local X axis (before rotation), in meters."
        },
        "height": {
          "type": "number",
          "exclusiveMinimum": 0,
          "description": "Footprint size along the slot's local Y axis (before rotation), in meters."
        }
      }
    },
    "slot": {
      "type": "object",
      "required": ["id", "x", "y"],
      "additionalProperties": false,
      "properties": {
        "id": {
          "type": "string",
          "description": "Real WMS location code (e.g. \"A01\"), used as the unique identifier."
        },
        "x": {
          "type": "number",
          "description": "Center point X coordinate (in meters) when depth is 1. With depth > 1, anchors the frontmost (depth position 0) sub-slot's own full-size footprint instead — additional sub-slots extend the footprint outward from there, so this point doesn't move as depth changes."
        },
        "y": {
          "type": "number",
          "description": "Center point Y coordinate (in meters) when depth is 1. See x for the depth > 1 case."
        },
        "rotationDeg": {
          "type": "number",
          "default": 0,
          "description": "Counter-clockwise rotation of the slot footprint around its center point, in degrees. 0 = width (slotDefaults.width) along +X, height along +Y. Usually a multiple of 90, but not restricted to one."
        },
        "depth": {
          "type": "integer",
          "minimum": 1,
          "default": 1,
          "description": "Number of sub-slot depth positions (front-to-back), each occupying its own full slotDefaults footprint (a depth-3 slot spans 3x the standard footprint, not the standard footprint split three ways). A physical/structural property, independent of what's currently stocked there — see warehouse.content.schema.json for that."
        },
        "access": {
          "$ref": "#/definitions/access",
          "description": "The corridor the slot is worked from — for a CML import, the aisle its label is written in."
        }
      }
    }
  }
}
