{
  "id": "bat-13a",
  "name": "Test plant",
  "units": "m",
  "walls": [
    {
      "id": "Main warehouse",
      "closed": true,
      "points": [
        {
          "x": 0,
          "y": 0
        },
        {
          "x": 40,
          "y": 0
        },
        {
          "x": 40,
          "y": 22
        },
        {
          "x": 0,
          "y": 22
        }
      ]
    },
    {
      "id": "Annex",
      "closed": true,
      "points": [
        {
          "x": 0,
          "y": -17
        },
        {
          "x": 16,
          "y": -17
        },
        {
          "x": 16,
          "y": -3
        },
        {
          "x": 0,
          "y": -3
        }
      ]
    }
  ],
  "doors": [
    {
      "id": "Door-South",
      "x": 10,
      "y": 0,
      "rotationDeg": 0,
      "buildingId": "Main warehouse"
    },
    {
      "id": "Door-Annex-North",
      "x": 10,
      "y": -3,
      "rotationDeg": 0,
      "buildingId": "Annex"
    }
  ],
  "junctions": [
    {
      "id": "MAIN.W",
      "x": 2,
      "y": 13,
      "buildingId": "Main warehouse"
    },
    {
      "id": "MAIN+SERVICE",
      "x": 24,
      "y": 13,
      "buildingId": "Main warehouse"
    },
    {
      "id": "MAIN:2",
      "x": 25,
      "y": 13,
      "buildingId": "Main warehouse"
    },
    {
      "id": "MAIN:3",
      "x": 25,
      "y": 19,
      "buildingId": "Main warehouse"
    },
    {
      "id": "MAIN:4",
      "x": 33,
      "y": 19,
      "buildingId": "Main warehouse"
    },
    {
      "id": "MAIN.S",
      "x": 33,
      "y": 2,
      "buildingId": "Main warehouse"
    },
    {
      "id": "SERVICE:1",
      "x": 24,
      "y": 6,
      "buildingId": "Main warehouse"
    },
    {
      "id": "SERVICE+DELIVERY",
      "x": 14,
      "y": 6,
      "buildingId": "Main warehouse"
    },
    {
      "id": "SERVICE+LIFT",
      "x": 10,
      "y": 6,
      "buildingId": "Main warehouse"
    },
    {
      "id": "Door-South",
      "x": 10,
      "y": 0,
      "buildingId": "Main warehouse"
    },
    {
      "id": "LIFT:1",
      "x": 6,
      "y": 6,
      "buildingId": "Main warehouse"
    },
    {
      "id": "LIFT.S",
      "x": 6,
      "y": 5,
      "buildingId": "Main warehouse"
    },
    {
      "id": "DELIVERY.S",
      "x": 14,
      "y": 5,
      "buildingId": "Main warehouse"
    },
    {
      "id": "Door-Annex-North",
      "x": 10,
      "y": -3,
      "buildingId": "Annex"
    },
    {
      "id": "ANNEX+ANNEX-AISLE",
      "x": 10,
      "y": -7,
      "buildingId": "Annex"
    },
    {
      "id": "ANNEX-AISLE.W",
      "x": 1,
      "y": -7,
      "buildingId": "Annex"
    },
    {
      "id": "ANNEX-AISLE.E",
      "x": 13,
      "y": -7,
      "buildingId": "Annex"
    }
  ],
  "corridors": [
    {
      "id": "MAIN",
      "junctions": [
        "MAIN.W",
        "MAIN+SERVICE",
        "MAIN:2",
        "MAIN:3",
        "MAIN:4",
        "MAIN.S"
      ]
    },
    {
      "id": "SERVICE",
      "junctions": [
        "MAIN+SERVICE",
        "SERVICE:1",
        "SERVICE+DELIVERY",
        "SERVICE+LIFT",
        "Door-South"
      ]
    },
    {
      "id": "LIFT",
      "junctions": [
        "SERVICE+LIFT",
        "LIFT:1",
        "LIFT.S"
      ]
    },
    {
      "id": "DELIVERY",
      "junctions": [
        "SERVICE+DELIVERY",
        "DELIVERY.S"
      ]
    },
    {
      "id": "BRIDGE",
      "junctions": [
        "Door-South",
        "Door-Annex-North"
      ]
    },
    {
      "id": "ANNEX",
      "junctions": [
        "Door-Annex-North",
        "ANNEX+ANNEX-AISLE"
      ]
    },
    {
      "id": "ANNEX-AISLE",
      "junctions": [
        "ANNEX-AISLE.W",
        "ANNEX+ANNEX-AISLE",
        "ANNEX-AISLE.E"
      ]
    }
  ],
  "liftStations": [
    {
      "id": "CL01",
      "x": 6,
      "y": 4,
      "rotationDeg": 0,
      "buildingId": "Main warehouse",
      "access": {
        "corridor": "LIFT",
        "offset": 5
      }
    }
  ],
  "deliverySpaces": [
    {
      "id": "DS01",
      "x": 14,
      "y": 4,
      "rotationDeg": 0,
      "buildingId": "Main warehouse",
      "access": {
        "corridor": "DELIVERY",
        "offset": 1
      }
    }
  ],
  "slotDefaults": {
    "width": 4,
    "height": 2
  },
  "slots": [
    {
      "id": "A01",
      "x": 4,
      "y": 15,
      "rotationDeg": 180,
      "depth": 3,
      "access": {
        "corridor": "MAIN",
        "offset": 2
      }
    },
    {
      "id": "A02",
      "x": 8,
      "y": 15,
      "rotationDeg": 180,
      "depth": 3,
      "access": {
        "corridor": "MAIN",
        "offset": 6
      }
    },
    {
      "id": "A03",
      "x": 12,
      "y": 15,
      "rotationDeg": 180,
      "depth": 3,
      "access": {
        "corridor": "MAIN",
        "offset": 10
      }
    },
    {
      "id": "A04",
      "x": 16,
      "y": 15,
      "rotationDeg": 180,
      "depth": 3,
      "access": {
        "corridor": "MAIN",
        "offset": 14
      }
    },
    {
      "id": "A05",
      "x": 20,
      "y": 15,
      "rotationDeg": 180,
      "depth": 3,
      "access": {
        "corridor": "MAIN",
        "offset": 18
      }
    },
    {
      "id": "B01",
      "x": 4,
      "y": 11,
      "depth": 2,
      "access": {
        "corridor": "MAIN",
        "offset": 2
      }
    },
    {
      "id": "B02",
      "x": 8,
      "y": 11,
      "depth": 2,
      "access": {
        "corridor": "MAIN",
        "offset": 6
      }
    },
    {
      "id": "B03",
      "x": 12,
      "y": 11,
      "depth": 2,
      "access": {
        "corridor": "MAIN",
        "offset": 10
      }
    },
    {
      "id": "B04",
      "x": 16,
      "y": 11,
      "depth": 2,
      "access": {
        "corridor": "MAIN",
        "offset": 14
      }
    },
    {
      "id": "B05",
      "x": 20,
      "y": 11,
      "depth": 2,
      "access": {
        "corridor": "MAIN",
        "offset": 18
      }
    },
    {
      "id": "N01",
      "x": 31,
      "y": 4,
      "rotationDeg": 270,
      "depth": 3,
      "access": {
        "corridor": "MAIN",
        "offset": 52
      }
    },
    {
      "id": "N02",
      "x": 31,
      "y": 8,
      "rotationDeg": 270,
      "depth": 3,
      "access": {
        "corridor": "MAIN",
        "offset": 48
      }
    },
    {
      "id": "N03",
      "x": 31,
      "y": 12,
      "rotationDeg": 270,
      "depth": 3,
      "access": {
        "corridor": "MAIN",
        "offset": 44
      }
    },
    {
      "id": "N04",
      "x": 31,
      "y": 16,
      "rotationDeg": 270,
      "depth": 3,
      "access": {
        "corridor": "MAIN",
        "offset": 40
      }
    },
    {
      "id": "M01",
      "x": 35,
      "y": 4,
      "rotationDeg": 90,
      "depth": 2,
      "access": {
        "corridor": "MAIN",
        "offset": 52
      }
    },
    {
      "id": "M02",
      "x": 35,
      "y": 8,
      "rotationDeg": 90,
      "depth": 2,
      "access": {
        "corridor": "MAIN",
        "offset": 48
      }
    },
    {
      "id": "M03",
      "x": 35,
      "y": 12,
      "rotationDeg": 90,
      "depth": 2,
      "access": {
        "corridor": "MAIN",
        "offset": 44
      }
    },
    {
      "id": "M04",
      "x": 35,
      "y": 16,
      "rotationDeg": 90,
      "depth": 2,
      "access": {
        "corridor": "MAIN",
        "offset": 40
      }
    },
    {
      "id": "C01",
      "x": 3,
      "y": -9,
      "depth": 2,
      "access": {
        "corridor": "ANNEX-AISLE",
        "offset": 2
      }
    },
    {
      "id": "C02",
      "x": 7,
      "y": -9,
      "depth": 2,
      "access": {
        "corridor": "ANNEX-AISLE",
        "offset": 6
      }
    },
    {
      "id": "C03",
      "x": 11,
      "y": -9,
      "depth": 2,
      "access": {
        "corridor": "ANNEX-AISLE",
        "offset": 10
      }
    }
  ]
}
